{
  "$schema": "https://json-schema.org/draft/2020-12/schema",
  "$id": "https://ai-training-platform.local/contracts/submission-contract.schema.json",
  "title": "Submission Contract",
  "type": "object",
  "additionalProperties": false,
  "required": ["schemaVersion", "required", "forbidden", "languageEntry"],
  "properties": {
    "schemaVersion": { "const": "1.0" },
    "required": {
      "type": "array",
      "minItems": 1,
      "items": { "$ref": "#/$defs/requiredItem" }
    },
    "optional": {
      "type": "array",
      "items": { "$ref": "#/$defs/optionalItem" }
    },
    "forbidden": {
      "type": "array",
      "items": { "type": "string", "minLength": 1 },
      "uniqueItems": true
    },
    "languageEntry": {
      "type": "object",
      "minProperties": 1,
      "additionalProperties": false,
      "patternProperties": {
        "^(python|java|go)$": { "type": "string", "minLength": 1 }
      }
    }
  },
  "$defs": {
    "path": { "type": "string", "minLength": 1, "pattern": "^(?!/)(?!.*\\.\\.)(?!.*\\\\).+$" },
    "requiredItem": {
      "type": "object",
      "additionalProperties": false,
      "required": ["path", "type"],
      "properties": {
        "path": { "$ref": "#/$defs/path" },
        "type": { "enum": ["markdown", "source", "directory", "text"] },
        "minSections": { "type": "integer", "minimum": 1 },
        "minChars": { "type": "integer", "minimum": 0 },
        "notTemplate": { "type": "boolean" },
        "mustExport": { "type": "string", "minLength": 1 },
        "signature": { "type": "string", "minLength": 1 }
      }
    },
    "optionalItem": {
      "type": "object",
      "additionalProperties": false,
      "required": ["path"],
      "properties": {
        "path": { "$ref": "#/$defs/path" },
        "type": { "enum": ["markdown", "source", "directory", "text"] }
      }
    }
  }
}
